Symbol,Name,Exchange
WEN,"Wendy's Company (The) Common Stock",NASDAQ
BAERW,"Bridger Aerospace Group Holdings, Inc. Warrant",NASDAQ
WERN,"Werner Enterprises, Inc. Common Stock",NASDAQ
BNRG,"Brenmiller Energy Ltd Ordinary Shares",NASDAQ
WES,"Western Midstream Partners, LP",NYSE
BNR,"Burning Rock Biotech Limited American Depositary Shares",NASDAQ
WEST,"Westrock Coffee Company Common Stock",NASDAQ
WEX,"WEX Inc.",NYSE
WEYS,"Weyco Group, Inc. Common Stock",NASDAQ
BNKKW,"Bonk, Inc. Warrant",NASDAQ
WF,"Woori Financial Group Inc. American Depositary Shares (each representing three (3) shares of Common Stock)",NYSE
WFC,"Wells Fargo & Co.",NYSE
BNKK,"Bonk, Inc. Common Stock",NASDAQ
BNJ,"Brookfield Finance I (UK) plc 4.50% Perpetual Subordinated Notes",NYSE
WFC.PRL,"WELLS FARGO 7.5% NON CUMV PERP CONV",NYSE
WFG,"West Fraser Timber Co. Ltd",NYSE
ASNS,"Actelis Networks, Inc. Common Stock",NASDAQ
WFRD,"Weatherford International plc Ordinary Shares",NASDAQ
WGO,"Winnebago Industries, Inc.",NYSE
WGS,"GeneDx Holdings Corp. Class A Common Stock",NASDAQ
WH,"Wyndham Hotels & Resorts, Inc. Common Stock",NYSE
WHD,"Cactus, Inc.",NYSE
WHF,"WhiteHorse Finance, Inc. Common Stock",NASDAQ
WHG,"WESTWOOD HOLDINGS GROUP, INC.",NYSE
WHR,"Whirlpool Corp.",NYSE
BNH,"Brookfield Finance Inc. 4.625% Subordinated Notes due October 16, 2080",NYSE
BNGO,"Bionano Genomics, Inc. Common Stock",NASDAQ
WHWK,"Whitehawk Therapeutics, Inc. Common Stock",NASDAQ
WINA,"Winmark Corporation Common Stock",NASDAQ
WING,"Wingstop Inc. Common Stock",NASDAQ
WIX,"Wix.com Ltd. Ordinary Shares",NASDAQ
WK,"Workiva Inc.",NYSE
WKC,"World Kinect Corporation",NYSE
WLDN,"Willdan Group, Inc. Common Stock",NASDAQ
WLFC,"Willis Lease Finance Corporation Common Stock",NASDAQ
WLK,"Westlake Corporation",NYSE
WLY,"John Wiley & Sons, Inc. Class A",NYSE
WM,"Waste Management, Inc.",NYSE
WMB,"Williams Companies Inc.",NYSE
WMG,"Warner Music Group Corp. Class A Common Stock",NASDAQ
BURU,"Nuburu, Inc.",AMEX
BUSEP,"First Busey Corporation Depositary Shares, Each Representing a 1/40thInterest in a Share of 8.25% Fixed-Rate Series B Non-Cumulative Perpetual Preferred Stock, $0.001 par value",NASDAQ
WMK,"Weis Markets, Inc.",NYSE
WMS,"ADVANCED DRAINAGE SYSTEMS, INC.",NYSE
WNC,"Wabash National Corp.",NYSE
BNDW,"Vanguard Scottsdale Funds Vanguard Total World Bond ETF",NASDAQ
WNEB,"Western New England Bancorp, Inc. Common Stock",NASDAQ
WOOF,"Petco Health and Wellness Company, Inc. Class A Common Stock",NASDAQ
WOR,"Worthington Enterprises, Inc.",NYSE
WOW,"WideOpenWest, Inc. Common Stock",NYSE
WPC,"W.P. Carey Inc. (REIT)",NYSE
WPM,"Wheaton Precious Metals Corp. Common Stock",NYSE
WPP,"WPP PLC",NYSE
WRB,"W.R. Berkley Corporation",NYSE
WRBY,"Warby Parker Inc.",NYSE
WRD,"WeRide Inc. American Depositary Shares",NASDAQ
WRLD,"World Acceptance Corporation Common Stock",NASDAQ
WS,"Worthington Steel, Inc.",NYSE
WSBC,"WesBanco, Inc. Common Stock",NASDAQ
WSBF,"Waterstone Financial, Inc. Common Stock (MD)",NASDAQ
BNCWW,"CEA Industries Inc. Warrant",NASDAQ
WSC,"WillScot Holdings Corporation Class A Common Stock",NASDAQ
WSFS,"WSFS Financial Corporation Common Stock",NASDAQ
WSM,"Williams-Sonoma, Inc.",NYSE
WSO,"Watsco, Inc.",NYSE
WSR,"Whitestone REIT",NYSE
WST,"West Pharmaceutical Services, Inc.",NYSE
BNC,"CEA Industries Inc. Common Stock",NASDAQ
WT,"WisdomTree, Inc.",NYSE
BUUU,"BUUU Group Limited Class A Ordinary Share",NASDAQ
WTBA,"West Bancorporation Common Stock",NASDAQ
WTFC,"Wintrust Financial Corporation Common Stock",NASDAQ
BMRA,"Biomerica, Inc. Common Stock",NASDAQ
WTI,"W&T Offshore, Inc.",NYSE
WTM,"White Mountains Insurance Group Ltd.",NYSE
WTRG,"Essential Utilities, Inc.",NYSE
WTS,"Watts Water Technologies, Inc. Class A",NYSE
WTTR,"Select Water Solutions, Inc.",NYSE
WTW,"Willis Towers Watson Public Limited Company Ordinary Shares",NASDAQ
WU,"The Western Union Company",NYSE
WULF,"TeraWulf Inc. Common Stock",NASDAQ
WVE,"Wave Life Sciences Ltd. Ordinary Shares",NASDAQ
WWD,"Woodward, Inc. Common Stock",NASDAQ
WWR,"Westwater Resources, Inc.",AMEX
WWW,"Wolverine World Wide, Inc.",NYSE
WY,"Weyerhaeuser Company",NYSE
WYNN,"Wynn Resorts, Limited Common stock",NASDAQ
WYY,"WidePoint Corporation",AMEX
BMR,"Beamr Imaging Ltd. Ordinary Share",NASDAQ
XBIL,"The RBB Fund, Inc. US Treasury 6 Month Bill ETF",NASDAQ
XBIT,"XBiotech Inc. Common Stock",NASDAQ
BMN,"BlackRock 2037 Municipal Target Term Trust",NYSE
XEL,"Xcel Energy Inc. Common Stock",NASDAQ
BML.PRL,"Bank of America Depositary Shares(Each representing 1/1200th interest in a share of Bank of America Corporation Floating Rate Non-Comulative Preferred Stock, Series5)",NYSE
XELLL,"Xcel Energy Inc. 6.25% Junior Subordinated Notes, Series due 2085",NASDAQ
XENE,"Xenon Pharmaceuticals Inc. Common Shares",NASDAQ
XERS,"Xeris Biopharma Holdings, Inc. Common Stock",NASDAQ
BML.PRJ,"Bank of America Depositary Shares(Each representing 1/1200th interest in a share of Bank of America Corporation Floating Rate Non-Cumulative Preferred Stock, Series4)",NYSE
BML.PRH,"Bank Of America Corporation Depositary Shares(Each representing a 1/1200th interest in a share of Bank of America Corporation Floating Rate Non-Cumulative Preferred Stock Series,2)",NYSE
XFLT,"XAI Octagon Floating Rate and Alternative Income Trust Common Shares of Beneficial Interest",NYSE
BML.PRG,"Bank Of America Corporation Depositary Shares(Each representing a 1/1200th interest in a share of Bank of America Corporation Floating Rate Non-Cumulative Preferred Stock Series,1)",NYSE
XGN,"Exagen Inc. Common Stock",NASDAQ
XHR,"Xenia Hotels & Resorts, Inc.",NYSE
XIFR,"XPLR Infrastructure, LP",NYSE
BAER,"Bridger Aerospace Group Holdings, Inc. Common Stock",NASDAQ
BMHL,"Bluemount Holdings Limited Class B Ordinary Shares",NASDAQ
BMGL,"Basel Medical Group Ltd Ordinary Shares",NASDAQ
BMEZ,"BlackRock Health Sciences Term Trust",NYSE
BMEA,"Biomea Fusion, Inc. Common Stock",NASDAQ
BMDL,"Victory Portfolios II VictoryShares WestEnd Economic Cycle Bond ETF",NASDAQ
BMAX,"ETF Opportunities Trust REX Bitcoin Corporate Treasury Convertible Bond ETF",NASDAQ
XMTR,"Xometry, Inc. Class A Common Stock",NASDAQ
BLZRU,"Trailblazer Acquisition Corp. Unit",NASDAQ
XNCR,"Xencor, Inc. Common Stock",NASDAQ
BLW,"Blackrock Limited Duration Income Trust",NYSE
BLUWW,"Blue Water Acquisition Corp. III Warrant.",NASDAQ
XNET,"Xunlei Limited American Depositary Shares",NASDAQ
XOM,"Exxon Mobil Corporation",NYSE
BLUWU,"Blue Water Acquisition Corp. III Unit.",NASDAQ
XOMA,"XOMA Royalty Corporation Common Stock",NASDAQ
XOVR,"EntrepreneurShares Series Trust ERShares Private-Public Crossover ETF",NASDAQ
XP,"XP Inc. Class A Common Stock",NASDAQ
XPEL,"XPEL, Inc. Common Stock",NASDAQ
XPER,"Xperi Inc",NYSE
XPEV,"XPeng Inc. American depositary shares, each representing two Class A ordinary shares",NYSE
XPO,"XPO, Inc.",NYSE
XPOF,"Xponential Fitness, Inc.",NYSE
XPRO,"Expro Group Holdings N.V.",NYSE
XRAY,"DENTSPLY SIRONA Inc. Common Stock",NASDAQ
BACQU,"Bleichroeder Acquisition Corp. I Unit",NASDAQ
XRX,"Xerox Holdings Corporation Common Stock",NASDAQ
BLUW,"Blue Water Acquisition Corp. III Class A Ordinary Shares",NASDAQ
XT,"iShares Trust iShares Future Exponential Technologies ETF",NASDAQ
XYL,"Xylem Inc",NYSE
XYZ,"Block, Inc.",NYSE
YALA,"Yalla Group Limited American Depositary Shares, each representing one Class A Ordinary Share",NYSE
YETI,"YETI Holdings, Inc. Common Stock",NYSE
YEXT,"Yext, Inc.",NYSE
YMM,"Full Truck Alliance Co. Ltd. American Depositary Shares (each representing 20 Class A Ordinary Shares)",NYSE
YORW,"York Water Company (The) Common Stock",NASDAQ
YOU,"Clear Secure, Inc.",NYSE
YPF,"YPF Sociedad Anonima",NYSE
YTRA,"Yatra Online, Inc. Ordinary Shares",NASDAQ
YUM,"Yum! Brands, Inc.",NYSE
YUMC,"Yum China Holdings, Inc. Common Stock",NYSE
Z,"Zillow Group, Inc. Class C Capital Stock",NASDAQ
ZBH,"Zimmer Biomet Holdings, Inc.",NYSE
ZBIO,"Zenas BioPharma, Inc. Common Stock",NASDAQ
ZBRA,"Zebra Technologies Corporation Class A Common Stock",NASDAQ
ZD,"Ziff Davis, Inc. Common Stock",NASDAQ
ZETA,"Zeta Global Holdings Corp.",NYSE
BACQR,"Bleichroeder Acquisition Corp. I Right",NASDAQ
ZEUS,"Olympic Steel, Inc. Common Stock",NASDAQ
ZG,"Zillow Group, Inc. Class A Common Stock",NASDAQ
ZGN,"Ermenegildo Zegna N.V.",NYSE
ZH,"Zhihu Inc. American Depositary Shares, each representing three (3) Class A Ordinary Shares",NYSE
ZIM,"ZIM Integrated Shipping Services Ltd.",NYSE
BLTE,"Belite Bio, Inc American Depositary Shares",NASDAQ
ZION,"Zions Bancorporation N.A. Common Stock",NASDAQ
ZIP,"ZipRecruiter, Inc.",NYSE
ZLAB,"Zai Lab Limited American Depositary Shares",NASDAQ
ZM,"Zoom Communications, Inc. Class A Common Stock",NASDAQ
ZNTL,"Zentalis Pharmaceuticals, Inc. Common Stock",NASDAQ
ZS,"Zscaler, Inc. Common Stock",NASDAQ
ZTO,"ZTO Express (Cayman) Inc. American Depositary Shares, each representing one Class A ordinary share",NYSE
ZUMZ,"Zumiez Inc. Common Stock",NASDAQ
ZURA,"Zura Bio Limited Class A Ordinary Shares",NASDAQ
ZVIA,"Zevia PBC",NYSE
ZVRA,"Zevra Therapeutics, Inc. Common Stock",NASDAQ
ZWS,"Zurn Elkay Water Solutions Corporation",NYSE
ZYME,"Zymeworks Inc. Common Stock",NASDAQ
BLRX,"BioLineRx Ltd. American Depositary Shares",NASDAQ
BACQ,"Bleichroeder Acquisition Corp. I Class A Ordinary Shares",NASDAQ
ALLW,"SSGA Active Trust SPDR Bridgewater All Weather ETF",NASDAQ
ALLR,"Allarity Therapeutics, Inc. Common Stock",NASDAQ
BACCU,"Blue Acquisition Corp. Unit",NASDAQ
BACCR,"Blue Acquisition Corp. Right",NASDAQ
ACGLN,"Arch Capital Group Ltd. Depositary Shares, each Representing a 1/1,000th Interest in a 4.550% Non-Cumulative Preferred Share, Series G",NASDAQ
BACC,"Blue Acquisition Corp. Class A Ordinary Shares",NASDAQ
BAC.PRS,"Bank of America Corporation Depositary shares, each representing 1/1,000th interest in a share of 4.750% Non-Cumulative Preferred Stock, Series SS",NYSE
BLNK,"Blink Charging Co. Common Stock",NASDAQ
BAC.PRP,"Bank of America Corporation Depositary Shares, each representing a 1/1,000th interest in a share of 4.125% Non- Cumulative Preferred Stock, Series PP",NYSE
BAC.PRN,"Bank of America Corporation Depositary shares, each representing 1/1,000th interest in a share of 5.000% Non-Cumulative Preferred Stock, Series LL",NYSE
BLNE,"Beeline Holdings, Inc. Common Stock",NASDAQ
BAC.PRM,"Bank of America Corporation Depositary Shares, each representing a 1/1,000th interest in a share of 5.375% Non-Cumulative Preferred Stock, Series KK",NYSE
BAC.PRL,"Bank Of America Corporation 7.25% Non-Cumulative Perpetual Convertible Preferred Stock, Series L",NYSE
ACFN,"Acorn Energy, Inc. Common Stock",NASDAQ
BAC.PRK,"Bank of America Corporation Depositary Shares, each representing a 1/1,000th interest in a share of 5.875% Non- Cumulative Preferred Stock, Series HH",NYSE
ALL.PRJ,"The Allstate Corporation Depositary Shares each representing a 1/1,000th interest in a share of Fixed Rate Noncumulative Perpetual Preferred Stock, Series J",NYSE
ACET,"Adicet Bio, Inc. Common Stock",NASDAQ
ALL.PRI,"The Allstate Corporation",NYSE
BAC.PRE,"Bank of America Corporation Depositary Shares (representing 1/1,000th of a share of Floating Rate Non-Cumalative Preferred Stock, Series E)",NYSE
AFGE,"American Financial Group, Inc. 4.500% Subordinated Debentures due 2060",NYSE
AFGD,"American Financial Group, Inc. 5.625% Subordinated Debentures due 2060",NYSE
FEMY,"Femasys Inc. Common Stock",NASDAQ
ALL.PRB,"The Allstate Corporation 5.100%  Fixed-To-Floating Rate Subordinated Debentures due 2053",NYSE
KLAR,"Klarna Group plc",NYSE
NMAX,"Newsmax, Inc.",NYSE
BLMZ,"Harrison Global Holdings Inc. Ordinary Shares",NASDAQ
PMI,"Picard Medical, Inc.",AMEX
AFGC,"American Financial Group, Inc. 5.125% Subordinated Debentures due 2059",NYSE
BAC.PRB,"Bank of America Corporation Depositary Shares, each representing a 1/1,000th interest in a share of 6.000% Non-Cumulative Preferred Stock, Series GG",NYSE
BLIV,"BeLive Holdings Ordinary Share",NASDAQ
AZYY,"GraniteShares ETF Trust GraniteShares YieldBoost AMZN ETF",NASDAQ
BLIN,"Bridgeline Digital, Inc. Common Stock",NASDAQ
SPMC,"Sound Point Meridian Capital, Inc.",NYSE
ALISU,"Calisa Acquisition Corp Units",NASDAQ
AFGB,"American Financial Group, Inc. 5.875% Subordinated Debentures due 2059",NYSE
AZTR,"Azitra Inc",AMEX
SMWB,"Similarweb Ltd.",NYSE
AZI,"Autozi Internet Technology (Global) Ltd. Class A Ordinary Shares",NASDAQ
AZ,"A2Z Cust2Mate Solutions Corp. Common Shares",NASDAQ
AYTU,"Aytu BioPharma, Inc. Common Stock",NASDAQ
AXS.PRE,"AXIS Capital Holdings Limited Depositary Shares, each representing 1/100th interest in a share of the Issuers 5.50% Series E Preferred Shares",NYSE
AXS,"Axis Capital Holders Limited",NYSE
DHAIW,"DIH Holding US, Inc. Warrants",NASDAQ
AXR,"AMREP Corporation",NYSE
AXINU,"Axiom Intelligence Acquisition Corp 1 Units",NASDAQ
AFBI,"Affinity Bancshares, Inc. Common Stock (MD)",NASDAQ
AXINR,"Axiom Intelligence Acquisition Corp 1 Right",NASDAQ
AXIN,"Axiom Intelligence Acquisition Corp 1 Class A Ordinary Shares",NASDAQ
AXIL,"AXIL Brands, Inc.",AMEX
BLE,"BlackRock Municipal Income Trust II",NYSE
ALIL,"EA Series Trust Argent Focused Small Cap ETF",NASDAQ
BKV,"BKV Corporation",NYSE
ALH,"Alliance Laundry Holdings Inc.",NYSE
AVXL,"Anavex Life Sciences Corp. Common Stock",NASDAQ
BLCR,"BlackRock ETF Trust iShares Large Cap Core Active ETF",NASDAQ
BLCO,"Bausch + Lomb Corporation",NYSE
ALFUW,"Centurion Acquisition Corp. Warrant",NASDAQ
ALFUU,"Centurion Acquisition Corp. Unit",NASDAQ
AVXC,"American Century ETF Trust Avantis Emerging Markets ex-China Equity ETF",NASDAQ
AFB,"Alliance National Municipal Income Fund, Inc.",NYSE
AVUQ,"American Century ETF Trust Avantis U.S. Quality ETF",NASDAQ
BLCN,"Siren ETF Trust Siren Nasdaq NexGen Economy ETF",NASDAQ
BLBX,"Blackboxstocks Inc. Common Stock",NASDAQ
BKYI,"BIO-key International, Inc. Common Stock",NASDAQ
BKT,"BlackRock Income Trust Inc.",NYSE
BKSY.WS,"BlackSky Technology Inc. Redeemable Warrants, each whole Warrant exercisable for one-eighth (1/8th) of a share of Class A Common Stock at an exercise price of $92.00 per whole share",NYSE
AVS,"Direxion Shares ETF Trust Direxion Daily AVGO Bear 1X Shares",NASDAQ
AVR,"Anteris Technologies Global Corp. Common Stock",NASDAQ
ACDC,"ProFrac Holding Corp. Class A Common Stock",NASDAQ
AVK,"Advent Convertible and Income Fund",NYSE
AVGX,"Tidal Trust II Defiance Daily Target 2X Long AVGO ETF",NASDAQ
AVGU,"GraniteShares ETF Trust GraniteShares 2x Long AVGO Daily ETF",NASDAQ
AVGG,"Themes ETF Trust Leverage Shares 2X Long AVGO Daily ETF",NASDAQ
AVGB,"American Century ETF Trust Avantis Credit ETF",NASDAQ
ACCS,"ACCESS Newswire Inc.",AMEX
ACCL,"Acco Group Holdings Limited Ordinary Shares",NASDAQ
AVBH,"Avidbank Holdings, Inc. Common Stock",NASDAQ
AVAL,"GRUPO AVAL ACCIONES Y VALORES S.A.",NYSE
AAM,"AA Mission Acquisition Corp.",NYSE
AUUDW,"Auddia Inc. Warrants",NASDAQ
AEXA,"American Exceptionalism Acquisition Corp. A",NYSE
AUUD,"Auddia Inc. Common Stock",NASDAQ
AUST,"Austin Gold Corp.",AMEX
ABVEW,"Above Food Ingredients Inc. Warrants",NASDAQ
ALF,"Centurion Acquisition Corp. Class A Ordinary Shares",NASDAQ
AUROW,"Aurora Innovation, Inc. Warrant",NASDAQ
ABVE,"Above Food Ingredients Inc. Common Stock",NASDAQ
AEVAW,"Aeva Technologies, Inc. Warrants",NASDAQ
AUNA,"Auna S.A.",NYSE
ABVC,"ABVC BioPharma, Inc. Common Stock",NASDAQ
BKKT.WS,"Bakkt Holdings, Inc Warrants to purchase Class A Common Stock Each Warrant entitles to purchase 1/25th of a share of Class A common stock at an exercise price of $287.50 for one share of Class A Common Stock",NYSE
BKKT,"Bakkt Holdings, Inc.",NYSE
ABTS,"Abits Group Inc Ordinary Shares",NASDAQ
CLM,"Cornerstone Strategic Investment Fund, Inc.",AMEX
AUMI,"Themes ETF Trust Themes Gold Miners ETF",NASDAQ
AUID,"authID Inc. Common Stock",NASDAQ
EVF,"Eaton Vance Senior Income Trust",NYSE
MMTXU,"Miluna Acquisition Corp Units",NASDAQ
AUDC,"AudioCodes Ltd. Common Stock",NASDAQ
AUBN,"Auburn National Bancorporation, Inc. Common Stock",NASDAQ
HAVAU,"Harvard Ave Acquisition Corporation Unit",NASDAQ
AWX,"Avalon Holdings Corp.",AMEX
HOVNP,"Hovnanian Enterprises Inc Dep Shr Srs A Pfd",NASDAQ
ATPC,"Agape ATP Corporation Common Stock",NASDAQ
BKHAU,"Black Hawk Acquisition Corporation Units",NASDAQ
ATOS,"Atossa Therapeutics, Inc. Common Stock",NASDAQ
ATOM,"Atomera Incorporated Common Stock",NASDAQ
ATMVU,"AlphaVest Acquisition Corp Unit",NASDAQ
ALDFW,"Aldel Financial II Inc. Warrants",NASDAQ
BKHAR,"Black Hawk Acquisition Corporation Rights",NASDAQ
BKHA,"Black Hawk Acquisition Corporation Class A Ordinary Shares",NASDAQ
ALDFU,"Aldel Financial II Inc. Units",NASDAQ
ALDF,"Aldel Financial II Inc. Class A Ordinary Shares",NASDAQ
ATMVR,"AlphaVest Acquisition Corp Right",NASDAQ
AERTW,"Aeries Technology, Inc. Warrant",NASDAQ
ATMV,"AlphaVest Acquisition Corp Ordinary Shares",NASDAQ
ATMCW,"AlphaTime Acquisition Corp Warrant",NASDAQ
ATMCU,"AlphaTime Acquisition Corp Unit",NASDAQ
BK,"Bank of New York Mellon Corporation",NYSE
AMYY,"GraniteShares ETF Trust GraniteShares YieldBOOST AMD ETF",NASDAQ
ALCYW,"Alchemy Investments Acquisition Corp 1 Warrants",NASDAQ
ATMCR,"AlphaTime Acquisition Corp Right",NASDAQ
ATMC,"AlphaTime Acquisition Corp Ordinary Shares",NASDAQ
BK.PRK,"The Bank of New York Mellon Corporation Depositary Shares, each representing a 1/4,000th interest in a share of Series K Noncumulative Perpetual Preferred Stock",NYSE
AERT,"Aeries Technology, Inc. Class A Ordinary Share",NASDAQ
BJK,"VanEck Gaming ETF",NASDAQ
CAPS,"Capstone Holding Corp. Common Stock",NASDAQ
ATLX,"Atlas Lithium Corporation Common Stock",NASDAQ
ATLN,"Atlantic International Corp. Common Stock",NASDAQ
BJDX,"Bluejay Diagnostics, Inc. Common Stock",NASDAQ
ATI,"ATI Inc.",NYSE
ATLCL,"Atlanticus Holdings Corporation 6.125% Senior Notes due 2026",NASDAQ
CDR.PRB,"CEDAR REALTY TRUST, INC. 7.25% Series B Cumulative Redeemable Preferred Stock",NYSE
AGL,"agilon health, inc.",NYSE
AGM.A,"Federal Agricultural Mortgage Corporation Class A Voting",NYSE
AQB,"AquaBounty Technologies, Inc. Common Stock",NASDAQ
AQMS,"Aqua Metals, Inc. Common Stock",NASDAQ
ARQQ,"Arqit Quantum Inc. Ordinary Shares",NASDAQ
ATON,"AlphaTON Capital Corp. Common Stock",NASDAQ
ATYR,"aTyr Pharma, Inc. Common Stock",NASDAQ
AUB.PRA,"Atlantic Union Bankshares Corporation Depositary Shares, Each Representing a 1/400th Interest in a Share of 6.875% Perpetual Non-Cumulative Preferred Stock, Series A",NYSE
BENFW,"Beneficient Warrant",NASDAQ
AEON,"AEON Biopharma, Inc.",AMEX
ALCYU,"Alchemy Investments Acquisition Corp 1 Units",NASDAQ
BIYA,"Baiya International Group Inc. Ordinary Shares",NASDAQ
CCSB,"Tidal Trust II Carbon Collective Short Duration Green Bond ETF",NASDAQ
BIVI,"BioVie Inc. Class A Common Stock",NASDAQ
CNCKW,"Coincheck Group N.V. Warrants",NASDAQ
ADVWW,"Advantage Solutions Inc. Warrant",NASDAQ
DIT,"AMCON Distributing Co.",AMEX
ERC,"Allspring Multi-Sector Income Fund",AMEX
BIRK,"Birkenstock Holding plc",NYSE
BIT,"BLACKROCK MULTI-SECTOR INCOME TRUST",NYSE
BIS,"ProShares Trust ProShares UltraShort Nasdaq Biotechnology",NASDAQ
BIRD,"Allbirds, Inc. Class A Common Stock",NASDAQ
BIPJ,"Brookfield Infrastructure Finance ULC 7.250% Subordinated Notes due 2084",NYSE
GPT,"EA Series Trust Intelligent Alpha Atlas ETF",NASDAQ
INLX,"Intellinetics, Inc.",AMEX
JZXN,"Jiuzi Holdings, Inc. Ordinary Shares",NASDAQ
KALA,"KALA BIO, Inc. Common Stock",NASDAQ
KZR,"Kezar Life Sciences, Inc. Common Stock",NASDAQ
BIPI,"BIP Bermuda Holdings I Limited 5.125% Perpetual Subordinated Notes",NYSE
LAC,"Lithium Americas Corp.",NYSE
MOLN,"Molecular Partners AG American Depositary Shares",NASDAQ
ATIIW,"Archimedes Tech SPAC Partners II Co. Warrant",NASDAQ
MTC,"MMTec, Inc. Common Shares",NASDAQ
MTEK,"Maris-Tech Ltd. Ordinary Shares",NASDAQ
MTEKW,"Maris-Tech Ltd. Warrants",NASDAQ
MVF,"BlackRock MuniVest Fund, Inc",NYSE
BIPH,"Brookfield Infrastructure Finance ULC 5.000% Subordinated Notes due 2081",NYSE
ATII,"Archimedes Tech SPAC Partners II Co. Ordinary Shares",NASDAQ
BIP.PRB,"Brookfield Infrastructure Partners L.P. 5.000% Class A Preferred Limited Partnership Units, Series 14",NYSE
NUKK,"Nukkleus Inc. Common Stock",NASDAQ
BIP.PRA,"Brookfield Infrastructure Partners L.P. 5.125% Class A Preferred Limited Partnership Units, Series 13",NYSE
NUKKW,"Nukkleus Inc. Warrants",NASDAQ
PBM,"Psyence Biomedical Ltd. Common Shares",NASDAQ
PHGE,"BiomX Inc.",AMEX
PRPL,"Purple Innovation, Inc. Common Stock",NASDAQ
PSCD,"Invesco Exchange-Traded Fund Trust II Invesco S&P SmallCap Consumer Discretionary ETF",NASDAQ
BIO.B,"Bio-Rad Laboratories, Inc. Class B",NYSE
PSCF,"Invesco Exchange-Traded Fund Trust II Invesco S&P SmallCap Financials ETF",NASDAQ
PSNY,"Polestar Automotive Holding UK PLC Class A ADS",NASDAQ
PSNYW,"Polestar Automotive Holding UK PLC Class C-1 ADS (ADW)",NASDAQ
QQHG,"Invesco Actively Managed Exchange-Traded Fund Trust Invesco QQQ Hedged Advantage ETF",NASDAQ
QQJG,"Invesco Exchange-Traded Fund Trust II Invesco ESG NASDAQ Next Gen 100 ETF",NASDAQ
RAAQU,"Real Asset Acquisition Corp. Unit",NASDAQ
RAC,"Rithm Acquisition Corp.",NYSE
RDZN,"Roadzen, Inc. Ordinary Shares",NASDAQ
RDZNW,"Roadzen, Inc. Warrants",NASDAQ
BW.PRA,"Babcock & Wilcox Enterprises, Inc. 7.75% Series A Cumulative Perpetual Preferred Stock",NYSE
RSF,"RiverNorth Capital and Income Fund, Inc.",NYSE
SJLD,"SanJac Alpha Low Duration ETF",NASDAQ
SPCE,"Virgin Galactic Holdings, Inc.",NYSE
SPCT,"Two Roads Shared Trust Liberty One Spectrum ETF",NASDAQ
TBMC,"Trailblazer Merger Corporation I Class A Common Stock",NASDAQ
VRAX,"Virax Biolabs Group Limited Ordinary Shares",NASDAQ
VRME,"VerifyMe, Inc. Common Stock",NASDAQ
VRTL,"GraniteShares ETF Trust GraniteShares 2x Long VRT Daily ETF",NASDAQ
WISE,"Themes ETF Trust Themes Generative Artificial Intelligence ETF",NASDAQ
ZONE,"CleanCore Solutions Inc.",AMEX
QB,"ProShares Trust ProShares Nasdaq-100 Dynamic Buffer ETF",NASDAQ
AENTW,"Alliance Entertainment Holding Corporation Warrants",NASDAQ
ATHS,"Athene Holding Ltd. 7.250% Fixed-Rate Reset Junior Subordinated Debentures due 2064",NYSE
ATHR,"Aether Holdings, Inc. Common Stock",NASDAQ
ABTC,"American Bitcoin Corp. Class A Common Stock",NASDAQ
ATHE,"Alterity Therapeutics Limited American Depositary Shares",NASDAQ
ATH.PRE,"Athene Holding Ltd. Depositary Shares, Each Representing a 1/1,000th Interest in a 7.750% Fixed-Rate Reset Perpetual Non-Cumulative Preference Share, Series E",NYSE
ATH.PRB,"Athene Holding Ltd. Depositary Shares, Each Representing a 1/1,000th Interest in a 5.625% Fixed Rate Perpetual Non- Cumulative Preference Share, Series B, par value $1.00 per share",NYSE
ATGL,"Alpha Technology Group Limited Class A Ordinary Shares",NASDAQ
BIAFW,"bioAffinity Technologies, Inc. Warrant",NASDAQ
SLNZ,"TCW Senior Loan ETF",NYSE
BIAF,"bioAffinity Technologies, Inc. Common Stock",NASDAQ
ABSI,"Absci Corporation Common Stock",NASDAQ
ATCO.PRH,"Atlas Corp. 7.875% Cumulative Redeemable Perpetual Preferred Shares - Series H",NYSE
ATCH,"AtlasClear Holdings, Inc.",AMEX
ALCY,"Alchemy Investments Acquisition Corp 1 Class A Ordinary Shares",NASDAQ
AAME,"Atlantic American Corporation Common Stock",NASDAQ
AENT,"Alliance Entertainment Holding Corporation Class A Common Stock",NASDAQ
BHV,"BlackRock Virginia Muni Bond Trust",NYSE
AAM.U,"AA Mission Acquisition Corp. Units, each consisting of one Class A Ordinary Share and one-half of one redeemable warrant",NYSE
ASTLW,"Algoma Steel Group Inc. Warrant",NASDAQ
BHR.PRD,"Braemar Hotels & Resorts Inc. 8.25% Series D Cumulative Preferred Stock, par value $0.01 per share",NYSE
ASTI,"Ascent Solar Technologies, Inc. Common Stock",NASDAQ
ENGNW,"enGene Holdings Inc. Warrants",NASDAQ
ABR.PRF,"Arbor Realty Trust, Inc. 6.25% Series F Fixed-to-Floating Rate Cumulative Redeemable Preferred Stock, Liquidation Preference $25.00 per share",NYSE
AEMD,"Aethlon Medical, Inc. Common Stock",NASDAQ
ASTC,"Astrotech Corporation (DE) Common Stock",NASDAQ
ASST,"Strive, Inc. Class A Common Stock",NASDAQ
BHR.PRB,"Braemar Hotels & Resorts Inc. 5.50% Series B Cumulative Convertible Preferred Stock",NYSE
BHM,"Bluerock Homes Trust, Inc.",AMEX
ABR.PRE,"Arbor Realty Trust, Inc. 6.25% Series E Cumulative Redeemable Preferred Stock",NYSE
ASRV,"AmeriServ Financial Inc. Common Stock",NASDAQ
AAPB,"GraniteShares ETF Trust GraniteShares 2x Long AAPL Daily ETF",NASDAQ
ASRT,"Assertio Holdings, Inc. Common Stock",NASDAQ
BHK,"BLACKROCK CORE BD TR",NYSE
AEI,"Alset Inc. Common Stock (TX)",NASDAQ
BHFAP,"Brighthouse Financial, Inc. Depositary Shares 6.6% Non-Cumulative Preferred Stock, Series A",NASDAQ
BHFAO,"Brighthouse Financial, Inc. Depositary Shares 6.75% Non-Cumulative Preferred Stock, Series B",NASDAQ
AEHL,"Antelope Enterprise Holdings Limited Class A Ordinary Shares",NASDAQ
ALBT,"Avalon GloboCare Corp. Common Stock",NASDAQ
AEFC,"Aegon Funding Company LLC 5.10% Subordinated Notes due 2049",NYSE
ASPSZ,"Altisource Portfolio Solutions S.A. Cash Exercise Stakeholder Warrants",NASDAQ
ASPSW,"Altisource Portfolio Solutions S.A. Net Settle Stakeholder Warrants",NASDAQ
ALB.PRA,"Albemarle Corporation Depositary Shares each representing a 1/20th interest in a share of 7.25% Series A Mandatory Convertible Preferred Stock",NYSE
ASPCU,"A SPAC III Acquisition Corp. Unit",NASDAQ
ASPCR,"A SPAC III Acquisition Corp. Right",NASDAQ
BHFAN,"Brighthouse Financial, Inc. Depositary shares, each representing a 1/1,000th interest in a share of 5.375% Non-Cumulative Preferred Stock, Series C",NASDAQ
ASPC,"A SPAC III Acquisition Corp. Class A Ordinary Shares",NASDAQ
ASIC,"Ategrity Specialty Insurance Company Holdings",NYSE
BHFAM,"Brighthouse Financial, Inc. Depositary shares each representing a 1/1,000th Interest in a Share of 4.625% Non-Cumulative Preferred Stock, Series D",NASDAQ
ALAR,"Alarum Technologies Ltd. American Depositary Share",NASDAQ
BHFAL,"Brighthouse Financial, Inc. 6.25% Junior Subordinated Debentures due 2058",NASDAQ
ABR.PRD,"Arbor Realty Trust, Inc. 6.375% Series D Cumulative Redeemable Preferred Stock, Liquidation Preference $25.00 per Share",NYSE
AEF,"abrdn Emerging Markets ex-China Fund, Inc.",AMEX
BHAT,"Blue Hat Interactive Entertainment Technology Ordinary Shares",NASDAQ
